{
  "id": "nurse-practitioner-resume-example",
  "title": "Nurse Practitioner Resume Example & Writing Guide for 2023",
  "slug": "nurse-practitioner-resume-example",
  "category": "healthcare",
  "occupation": "nurse-practitioner",
  "publishedDate": "2023-09-15T10:00:00Z",
  "updatedDate": "2023-10-20T14:30:00Z",
  "author": {
    "name": "Emma Johnson",
    "avatar": "/images/blog/authors/emma-johnson.jpg",
    "bio": "Emma is a healthcare career advisor with 8+ years of experience helping medical professionals advance their careers."
  },
  "featuredImage": {
    "src": "/images/blog/occupations/nurse-practitioner-resume-header.jpg",
    "alt": "Professional Nurse Practitioner reviewing patient charts",
    "caption": "Create a standout Nurse Practitioner resume with our expert guide and example"
  },
  "content": {
    "introduction": "<p>Creating a strong Nurse Practitioner resume is essential in today's competitive healthcare job market. As advanced practice registered nurses with expanded clinical responsibilities, Nurse Practitioners need resumes that effectively showcase their clinical expertise, certifications, and patient care philosophy.</p><p>In this comprehensive guide, we'll walk through exactly how to create a professional Nurse Practitioner resume that highlights your unique qualifications and helps you land interviews for your ideal role. We'll cover the essential sections, key skills to include, and provide a professional resume example you can use as inspiration.</p>",
    "sections": [
      {
        "title": "What Makes a Great Nurse Practitioner Resume",
        "id": "what-makes-great-np-resume",
        "content": "<p>A successful Nurse Practitioner resume clearly demonstrates your clinical competencies, specialized training, and patient care approach. Hiring managers typically spend just 6-7 seconds scanning each resume, so your NP resume needs to quickly convey your value as a healthcare provider.</p><p>The best Nurse Practitioner resumes include:</p><ul><li>Clear presentation of credentials and certifications</li><li>Quantifiable achievements and patient outcomes</li><li>Specialized clinical skills relevant to the position</li><li>Experience with electronic medical record systems</li><li>Evidence of collaboration with healthcare teams</li></ul>"
      },
      {
        "title": "Essential Sections for Your Nurse Practitioner Resume",
        "id": "essential-sections",
        "content": "<h3>Professional Summary</h3><p>Begin with a concise 3-4 line summary highlighting your NP specialty, years of experience, and most impressive accomplishments. This section should be tailored to each position you apply for.</p><h3>Licensure and Certifications</h3><p>List your nursing license, NP certification, and any specialty certifications prominently near the top of your resume. Include your license number, certifying body, and expiration dates.</p><h3>Clinical Experience</h3><p>Detail your work history in reverse chronological order, focusing on clinical responsibilities and achievements. Use action verbs and include metrics when possible, such as patient volume, improvement in outcomes, or efficiency gains.</p><h3>Education</h3><p>List your nursing degrees, starting with your highest level of education. Include the institution name, degree earned, and graduation date.</p><h3>Skills</h3><p>Include both clinical skills (patient assessment, medication management) and soft skills (communication, empathy) relevant to nurse practitioner roles.</p>"
      },
      {
        "title": "Key Skills to Highlight on Your Nurse Practitioner Resume",
        "id": "key-skills",
        "content": "<p>Nurse Practitioners should highlight a combination of clinical competencies, technical skills, and interpersonal abilities:</p><h3>Clinical Skills</h3><ul><li>Comprehensive patient assessment</li><li>Diagnostic reasoning</li><li>Treatment planning</li><li>Medication management</li><li>Chronic disease management</li><li>Preventive care</li><li>Wound care</li><li>Telehealth services</li></ul><h3>Technical Skills</h3><ul><li>Electronic Medical Records (Epic, Cerner, etc.)</li><li>E-prescribing systems</li><li>Medical office software</li><li>Diagnostic equipment operation</li><li>Telehealth platforms</li></ul><h3>Soft Skills</h3><ul><li>Patient education</li><li>Interprofessional collaboration</li><li>Cultural competence</li><li>Critical thinking</li><li>Communication</li><li>Empathy and compassion</li><li>Time management</li><li>Adaptability</li></ul>"
      },
      {
        "title": "How to Write Compelling Experience Bullet Points",
        "id": "experience-bullets",
        "content": "<p>Your experience section should demonstrate both your clinical capabilities and the impact of your work. Use the following formula for effective bullet points:</p><p><strong>Action Verb + Specific Task + Result/Impact</strong></p><p>Examples:</p><ul><li>Conducted comprehensive health assessments for 20+ patients daily, developing and implementing treatment plans that improved patient outcomes by 35%</li><li>Collaborated with multidisciplinary healthcare teams to provide holistic care, resulting in 28% reduction in hospital readmissions</li><li>Managed medication protocols for chronic disease patients, achieving 95% medication adherence rate</li><li>Implemented new telehealth program that increased access to care for rural patients by 40%</li></ul>"
      },
      {
        "title": "ATS Optimization Tips for Nurse Practitioner Resumes",
        "id": "ats-optimization",
        "content": "<p>Most healthcare employers use Applicant Tracking Systems (ATS) to screen resumes before human review. To ensure your resume passes ATS filters:</p><ul><li>Include keywords from the job description (clinical skills, certifications, specific EMR systems)</li><li>Use standard section headings (Experience, Education, Skills)</li><li>Avoid tables, graphics, or unusual formatting</li><li>Submit in PDF format unless otherwise specified</li><li>Include the exact certification names and acronyms (both spelled out and abbreviated)</li></ul>"
      }
    ],
    "resumeExample": {
      "template": "ats",
      "content": {
        "personalInfo": {
          "name": "Sarah J. Thompson",
          "title": "Family Nurse Practitioner",
          "email": "saraht@example.com",
          "phone": "(555) 123-4567",
          "location": "Portland, OR"
        },
        "summary": "Compassionate Family Nurse Practitioner with 7+ years of experience providing comprehensive primary care to diverse patient populations. Skilled in chronic disease management, preventive care, and patient education with a focus on holistic health outcomes. Consistently maintains 95% patient satisfaction ratings while reducing unnecessary ER visits by 30% through proactive care management.",
        "experience": [
          {
            "position": "Family Nurse Practitioner",
            "company": "Portland Community Health Center",
            "location": "Portland, OR",
            "startDate": "June 2019",
            "endDate": "Present",
            "highlights": [
              "Provide comprehensive primary care services to 500+ patients, managing acute and chronic conditions across the lifespan",
              "Developed and implemented diabetes management protocol that improved A1C levels in 75% of diabetic patients within 6 months",
              "Coordinate care with specialists and social services to address social determinants of health, reducing hospital readmissions by 28%",
              "Precept NP students, providing clinical instruction and mentorship to 3-4 students annually"
            ]
          },
          {
            "position": "Registered Nurse - Primary Care",
            "company": "Oregon Health Sciences University",
            "location": "Portland, OR",
            "startDate": "May 2016",
            "endDate": "May 2019",
            "highlights": [
              "Conducted patient intake, assessment, and triage for busy primary care practice serving 40+ patients daily",
              "Managed chronic care coordination program for high-risk patients, reducing ER visits by 35%",
              "Implemented patient education initiative for hypertension management, resulting in improved medication adherence and blood pressure control for 80% of participants"
            ]
          }
        ],
        "education": [
          {
            "degree": "Master of Science in Nursing - Family Nurse Practitioner",
            "institution": "Oregon Health & Science University",
            "location": "Portland, OR",
            "completionDate": "2019"
          },
          {
            "degree": "Bachelor of Science in Nursing",
            "institution": "University of Washington",
            "location": "Seattle, WA",
            "completionDate": "2015"
          }
        ],
        "certifications": [
          "Family Nurse Practitioner (FNP-BC), American Nurses Credentialing Center, 2019",
          "Basic Life Support (BLS), American Heart Association, Current",
          "Advanced Cardiac Life Support (ACLS), American Heart Association, Current",
          "DEA Registration, Current"
        ],
        "skills": [
          "Comprehensive Health Assessment",
          "Diagnostic Reasoning",
          "Treatment Planning",
          "Chronic Disease Management",
          "Medication Management",
          "Patient Education",
          "Electronic Medical Records (Epic)",
          "Telehealth Services",
          "Preventive Care",
          "Collaborative Practice"
        ]
      },
      "image": "/images/blog/occupations/nurse-practitioner-resume-example.jpg"
    },
    "skillsSection": {
      "hardSkills": [
        "Patient Assessment",
        "Diagnostic Testing",
        "Treatment Planning",
        "Medication Management",
        "Electronic Medical Records (EMR)",
        "ICD-10 Coding",